{
  "id": 41,
  "type": "turn.committed",
  "conversation_id": "22222222-2222-4222-8222-222222222222",
  "branch_id": "55555555-5555-4555-8555-555555555555",
  "emitted_at": "2026-09-05T00:00:00Z",
  "data": {
    "turn_id": "33333333-3333-4333-8333-333333333333",
    "scene_revision": 13,
    "message_ids": [
      "77777777-7777-4777-8777-777777777777"
    ],
    "utterances": [
      {
        "kind": "character",
        "speaker_instance_id": "44444444-4444-4444-8444-444444444444",
        "text": "The road forks here."
      }
    ]
  }
}
